<?xml version="1.0" encoding="UTF-8"?>
<attackTree
        xmlns:xsi="http://www.w3.org/2001/XMLSchema-instance" xmlns=""
        xsi:noNamespaceSchemaLocation="attackTreeExtended.xsd">
    <meta>
        <title>Web-Server attack</title>
        <author>Daniel Fischer</author>
        <date>2017-11-13</date>
        <description>This tree visualises the attack on an Web Server</description>
        <root>N0000</root>
    </meta>
    <threats>
        <threat id="N0000">
            <title>Web-Server attack</title>
            <description>Attack on an Web-Server</description>
        </threat>
        <threat id="N0001">
            <title>Password gathering</title>
            <description>Get the passwords</description>
        </threat>
        <threat id="N0002">
            <title>Brute Forcing</title>
            <description>Brute Forcing the password</description>
        </threat>
        <threat id="N0003">
            <title>Social Engineering the password</title>
            <description>Social Engineering the password</description>
        </threat>
    </threats>
    <countermeasures>
        <countermeasure id="N0004">
            <title>Long Passwords</title>
            <description>Set password length > 20</description>
        </countermeasure>
        <countermeasure id="N0005">
            <title>IDS for password forms</title>
            <description>Set up a IDS to find brute force attempts</description>
        </countermeasure>
        <countermeasure id="N0006">
            <title>Social engineering seminars</title>
            <description>Set up seminars to counter social engineering</description>
        </countermeasure>
    </countermeasures>
    <conjunctions>
        <conjunction type="alternative" id="N1001"/>
        <conjunction type="composition" id="N1002"/>
        <conjunction type="alternative" id="N1003"/>
        <conjunction type="alternative" id="N1004"/>
        <conjunction type="alternative" id="N1005"/>
    </conjunctions>
    <connections>
        <connection source="N0000" destination="N1001"/>
        <connection source="N1001" destination="N0001"/>
        <connection source="N0001" destination="N1002"/>
        <connection source="N1002" destination="N0002"/>
        <connection source="N0001" destination="N1003"/>
        <connection source="N1003" destination="N0004"/>
        <connection source="N1003" destination="N0005"/>
        <connection source="N0002" destination="N1004"/>
        <connection source="N1004" destination="N0003"/>
        <connection source="N0003" destination="N1005"/>
        <connection source="N1005" destination="N0002"/>
    </connections>
</attackTree>